No.,Time,Source,Destination,Protocol,Length,Info,label
1,0.0,204.79.197.222,FioImma.local,TCP,60,443  >  54796 [ACK] Seq=1 Ack=1 Win=2048 Len=0,TCP Traffic
2,0.001887,204.79.197.222,FioImma.local,TLSv1.2,513,Application Data,Other
3,0.001887,204.79.197.222,FioImma.local,TLSv1.2,116,Application Data,Other
4,0.001887,204.79.197.222,FioImma.local,TCP,60,443  >  54796 [ACK] Seq=522 Ack=81 Win=2048 Len=0,TCP Traffic
5,0.001887,204.79.197.222,FioImma.local,TLSv1.2,85,Application Data,Other
6,0.001993,FioImma.local,204.79.197.222,TCP,54,54796  >  443 [ACK] Seq=936 Ack=553 Win=1021 Len=0,TCP Traffic
7,0.003792,FioImma.local,204.79.197.222,TLSv1.2,85,Application Data,Other
8,0.04268,204.79.197.222,FioImma.local,TCP,60,443  >  54796 [ACK] Seq=553 Ack=967 Win=2048 Len=0,TCP Traffic
9,0.14063,204.79.197.222,FioImma.local,TLSv1.2,240,Application Data,Other
10,0.14063,204.79.197.222,FioImma.local,TLSv1.2,85,Application Data,Other
11,0.140711,FioImma.local,204.79.197.222,TCP,54,54796  >  443 [ACK] Seq=967 Ack=770 Win=1020 Len=0,TCP Traffic
12,0.239727,FioImma.local,browser-intake-datadoghq.com,TCP,55,54759  >  443 [ACK] Seq=1 Ack=1 Win=513 Len=1,TCP Traffic
13,0.465458,browser-intake-datadoghq.com,FioImma.local,TCP,66,443  >  54759 [ACK] Seq=1 Ack=2 Win=62 Len=0 SLE=1 SRE=2,TCP Traffic
14,0.72037,FioImma.local,mars.octa.edu,DNS,98,Standard query 0xb437 PTR 222.197.79.204.in-addr.arpa OPT,Other
15,0.721234,FioImma.local,mars.octa.edu,DNS,96,Standard query 0x03c8 PTR 40.1.168.192.in-addr.arpa OPT,Other
16,0.721731,FioImma.local,mars.octa.edu,DNS,96,Standard query 0xc288 PTR 26.158.233.3.in-addr.arpa OPT,Other
17,0.73671,mars.octa.edu,FioImma.local,DNS,96,Standard query response 0x03c8 No such name PTR 40.1.168.192.in-addr.arpa OPT,Other
18,0.73671,mars.octa.edu,FioImma.local,DNS,168,Standard query response 0xb437 No such name PTR 222.197.79.204.in-addr.arpa SOA ns1.msedge.net OPT,Other
19,0.755094,mars.octa.edu,FioImma.local,DNS,150,Standard query response 0xc288 PTR 26.158.233.3.in-addr.arpa PTR ec2-3-233-158-26.compute-1.amazonaws.com OPT,Other
20,1.734154,FioImma.local,mars.octa.edu,DNS,93,Standard query 0x649b PTR 41.0.0.10.in-addr.arpa OPT,Other
21,1.740796,mars.octa.edu,FioImma.local,DNS,120,Standard query response 0x649b PTR 41.0.0.10.in-addr.arpa PTR mars.octa.edu OPT,Other
22,3.915724,FioImma.local,mars.octa.edu,DNS,90,Standard query 0x06e2 A self.events.data.microsoft.com,Other
23,3.923278,mars.octa.edu,FioImma.local,DNS,213,Standard query response 0x06e2 A self.events.data.microsoft.com CNAME self-events-data.trafficmanager.net CNAME onedscolprdneu09.northeurope.cloudapp.azure.com A 13.69.239.77,Other
24,3.924582,FioImma.local,onedscolprdneu09.northeurope.cloudapp.azure.com,TCP,66,54797  >  443 [SYN] Seq=0 Win=65535 Len=0 MSS=1460 WS=256 SACK_PERM,TCP Traffic
25,4.089561,onedscolprdneu09.northeurope.cloudapp.azure.com,FioImma.local,TCP,66,"443  >  54797 [SYN, ACK] Seq=0 Ack=1 Win=65535 Len=0 MSS=1440 WS=256 SACK_PERM",TCP Traffic
26,4.08973,FioImma.local,onedscolprdneu09.northeurope.cloudapp.azure.com,TCP,54,54797  >  443 [ACK] Seq=1 Ack=1 Win=262144 Len=0,TCP Traffic
27,4.09286,FioImma.local,onedscolprdneu09.northeurope.cloudapp.azure.com,TLSv1.3,445,Client Hello (SNI=self.events.data.microsoft.com),Other
28,4.259201,onedscolprdneu09.northeurope.cloudapp.azure.com,FioImma.local,TLSv1.3,153,"Hello Retry Request, Change Cipher Spec",Other
29,4.259366,FioImma.local,onedscolprdneu09.northeurope.cloudapp.azure.com,TCP,54,54797  >  443 [ACK] Seq=392 Ack=100 Win=261888 Len=0,TCP Traffic
30,4.284396,FioImma.local,onedscolprdneu09.northeurope.cloudapp.azure.com,TLSv1.3,516,"Change Cipher Spec, Client Hello (SNI=self.events.data.microsoft.com)",Other
31,4.460794,onedscolprdneu09.northeurope.cloudapp.azure.com,FioImma.local,TLSv1.3,1514,Server Hello,Other
32,4.460952,FioImma.local,onedscolprdneu09.northeurope.cloudapp.azure.com,TCP,54,54797  >  443 [ACK] Seq=854 Ack=1560 Win=262144 Len=0,TCP Traffic
33,4.462666,onedscolprdneu09.northeurope.cloudapp.azure.com,FioImma.local,TCP,4434,443  >  54797 [ACK] Seq=1560 Ack=854 Win=524288 Len=4380 [TCP PDU reassembled in 34],TCP Traffic
34,4.462666,onedscolprdneu09.northeurope.cloudapp.azure.com,FioImma.local,TLSv1.3,600,Application Data,Other
35,4.462816,FioImma.local,onedscolprdneu09.northeurope.cloudapp.azure.com,TCP,54,54797  >  443 [ACK] Seq=854 Ack=6486 Win=262144 Len=0,TCP Traffic
36,4.475078,FioImma.local,onedscolprdneu09.northeurope.cloudapp.azure.com,TLSv1.3,128,Application Data,Other
37,4.475461,FioImma.local,onedscolprdneu09.northeurope.cloudapp.azure.com,TLSv1.3,1083,Application Data,Other
38,4.495702,FioImma.local,102.221.186.35.bc.googleusercontent.com,TCP,55,54633  >  443 [ACK] Seq=1 Ack=1 Win=512 Len=1 [TCP PDU reassembled in 502],TCP Traffic
39,4.507488,102.221.186.35.bc.googleusercontent.com,FioImma.local,TCP,66,443  >  54633 [ACK] Seq=1 Ack=2 Win=345 Len=0 SLE=1 SRE=2,TCP Traffic
40,4.642298,onedscolprdneu09.northeurope.cloudapp.azure.com,FioImma.local,TCP,60,443  >  54797 [ACK] Seq=6486 Ack=1957 Win=524288 Len=0,TCP Traffic
41,4.65311,onedscolprdneu09.northeurope.cloudapp.azure.com,FioImma.local,TLSv1.3,157,Application Data,Other
42,4.653212,FioImma.local,onedscolprdneu09.northeurope.cloudapp.azure.com,TCP,54,54797  >  443 [ACK] Seq=1957 Ack=6589 Win=261888 Len=0,TCP Traffic
43,4.655417,FioImma.local,onedscolprdneu09.northeurope.cloudapp.azure.com,TCP,54,"54797  >  443 [FIN, ACK] Seq=1957 Ack=6589 Win=261888 Len=0",TCP Traffic
44,4.991236,onedscolprdneu09.northeurope.cloudapp.azure.com,FioImma.local,TCP,54,443  >  54797 [ACK] Seq=6589 Ack=1958 Win=524288 Len=0,TCP Traffic
45,5.018179,FioImma.local,gce-beacons.gcp.gvt2.com,TCP,55,54769  >  443 [ACK] Seq=1 Ack=1 Win=510 Len=1 [TCP PDU reassembled in 499],TCP Traffic
46,5.100235,gce-beacons.gcp.gvt2.com,FioImma.local,TCP,66,443  >  54769 [ACK] Seq=1 Ack=2 Win=249 Len=0 SLE=1 SRE=2,TCP Traffic
47,5.139425,onedscolprdneu09.northeurope.cloudapp.azure.com,FioImma.local,TLSv1.3,201,Application Data,Other
48,5.139425,onedscolprdneu09.northeurope.cloudapp.azure.com,FioImma.local,TCP,54,"443  >  54797 [FIN, ACK] Seq=6736 Ack=1958 Win=524288 Len=0",TCP Traffic
49,5.139551,FioImma.local,onedscolprdneu09.northeurope.cloudapp.azure.com,TCP,54,"54797  >  443 [RST, ACK] Seq=1958 Ack=6736 Win=0 Len=0",TCP Traffic
50,5.286889,FioImma.local,mars.octa.edu,DNS,88,Standard query 0xcb02 A browser-intake-datadoghq.com,Other
51,5.287236,FioImma.local,mars.octa.edu,DNS,88,Standard query 0x4b59 HTTPS browser-intake-datadoghq.com,Other
52,5.293202,mars.octa.edu,FioImma.local,DNS,136,Standard query response 0xcb02 A browser-intake-datadoghq.com A 3.233.158.24 A 3.233.158.25 A 3.233.158.26,Other
53,5.295732,mars.octa.edu,FioImma.local,DNS,172,Standard query response 0x4b59 HTTPS browser-intake-datadoghq.com SOA ns-1907.awsdns-46.co.uk,Other
54,5.296409,FioImma.local,www.google.com,TCP,54,"54782  >  443 [FIN, ACK] Seq=1 Ack=1 Win=512 Len=0",TCP Traffic
55,5.296876,FioImma.local,browser-intake-datadoghq.com,TCP,66,54798  >  443 [SYN] Seq=0 Win=64240 Len=0 MSS=1460 WS=256 SACK_PERM,TCP Traffic
56,5.306182,www.google.com,FioImma.local,TCP,54,443  >  54782 [RST] Seq=1 Win=0 Len=0,TCP Traffic
57,5.522439,browser-intake-datadoghq.com,FioImma.local,TCP,66,"443  >  54798 [SYN, ACK] Seq=0 Ack=1 Win=31740 Len=0 MSS=1380 SACK_PERM WS=512",TCP Traffic
58,5.52257,FioImma.local,browser-intake-datadoghq.com,TCP,54,54798  >  443 [ACK] Seq=1 Ack=1 Win=131072 Len=0,TCP Traffic
59,5.525206,FioImma.local,browser-intake-datadoghq.com,TCP,1434,54798  >  443 [ACK] Seq=1 Ack=1 Win=131072 Len=1380 [TCP PDU reassembled in 60],TCP Traffic
60,5.525206,FioImma.local,browser-intake-datadoghq.com,TLSv1.3,747,Client Hello (SNI=browser-intake-datadoghq.com),Other
61,5.748153,browser-intake-datadoghq.com,FioImma.local,TCP,60,443  >  54798 [ACK] Seq=1 Ack=1381 Win=31232 Len=0,TCP Traffic
62,5.748153,browser-intake-datadoghq.com,FioImma.local,TCP,60,443  >  54798 [ACK] Seq=1 Ack=2074 Win=31744 Len=0,TCP Traffic
63,5.748153,browser-intake-datadoghq.com,FioImma.local,TLSv1.3,266,"Server Hello, Change Cipher Spec, Application Data",Other
64,5.749761,FioImma.local,mars.octa.edu,DNS,98,Standard query 0xf940 PTR 102.221.186.35.in-addr.arpa OPT,Other
65,5.750063,FioImma.local,browser-intake-datadoghq.com,TLSv1.3,118,"Change Cipher Spec, Application Data",Other
66,5.750106,FioImma.local,mars.octa.edu,DNS,98,Standard query 0x6e95 PTR 127.128.220.35.in-addr.arpa OPT,Other
67,5.750372,FioImma.local,mars.octa.edu,DNS,99,Standard query 0xf451 PTR 228.205.250.142.in-addr.arpa OPT,Other
68,5.750422,FioImma.local,browser-intake-datadoghq.com,TLSv1.3,146,Application Data,Other
69,5.750802,FioImma.local,browser-intake-datadoghq.com,TLSv1.3,699,Application Data,Other
70,5.750885,FioImma.local,browser-intake-datadoghq.com,TLSv1.3,987,Application Data,Other
71,5.767076,mars.octa.edu,FioImma.local,DNS,137,Standard query response 0xf451 PTR 228.205.250.142.in-addr.arpa PTR maa05s28-in-f4.1e100.net OPT,Other
72,5.779998,FioImma.local,maa03s28-in-f3.1e100.net,TCP,55,54772  >  443 [ACK] Seq=1 Ack=1 Win=512 Len=1,TCP Traffic
73,5.783526,mars.octa.edu,FioImma.local,DNS,151,Standard query response 0xf940 PTR 102.221.186.35.in-addr.arpa PTR 102.221.186.35.bc.googleusercontent.com OPT,Other
74,5.787823,mars.octa.edu,FioImma.local,DNS,151,Standard query response 0x6e95 PTR 127.128.220.35.in-addr.arpa PTR 127.128.220.35.bc.googleusercontent.com OPT,Other
75,5.79079,maa03s28-in-f3.1e100.net,FioImma.local,TCP,66,443  >  54772 [ACK] Seq=1 Ack=2 Win=301 Len=0 SLE=1 SRE=2,TCP Traffic
76,5.974592,browser-intake-datadoghq.com,FioImma.local,TCP,60,443  >  54798 [ACK] Seq=213 Ack=2230 Win=31744 Len=0,TCP Traffic
77,5.974592,browser-intake-datadoghq.com,FioImma.local,TLSv1.3,581,"Application Data, Application Data",Other
78,5.974592,browser-intake-datadoghq.com,FioImma.local,TCP,60,443  >  54798 [ACK] Seq=740 Ack=3808 Win=31744 Len=0,TCP Traffic
79,5.97516,FioImma.local,browser-intake-datadoghq.com,TLSv1.3,85,Application Data,Other
80,6.022645,browser-intake-datadoghq.com,FioImma.local,TLSv1.3,363,Application Data,Other
81,6.066112,FioImma.local,browser-intake-datadoghq.com,TCP,54,54798  >  443 [ACK] Seq=3839 Ack=1049 Win=130048 Len=0,TCP Traffic
82,6.243757,browser-intake-datadoghq.com,FioImma.local,TCP,60,443  >  54798 [ACK] Seq=1049 Ack=3839 Win=31744 Len=0,TCP Traffic
83,6.257781,FioImma.local,ec2-35-174-127-31.compute-1.amazonaws.com,TLSv1.2,297,Application Data,Other
84,6.492246,ec2-35-174-127-31.compute-1.amazonaws.com,FioImma.local,TLSv1.2,320,Application Data,Other
85,6.542869,FioImma.local,ec2-35-174-127-31.compute-1.amazonaws.com,TCP,54,54503  >  443 [ACK] Seq=244 Ack=267 Win=513 Len=0,TCP Traffic
86,6.750986,FioImma.local,mars.octa.edu,DNS,98,Standard query 0xad78 PTR 195.31.217.172.in-addr.arpa OPT,Other
87,6.751341,FioImma.local,mars.octa.edu,DNS,97,Standard query 0x3df8 PTR 31.127.174.35.in-addr.arpa OPT,Other
88,6.769241,mars.octa.edu,FioImma.local,DNS,136,Standard query response 0xad78 PTR 195.31.217.172.in-addr.arpa PTR maa03s28-in-f3.1e100.net OPT,Other
89,6.78787,mars.octa.edu,FioImma.local,DNS,152,Standard query response 0x3df8 PTR 31.127.174.35.in-addr.arpa PTR ec2-35-174-127-31.compute-1.amazonaws.com OPT,Other
90,6.98366,FioImma.local,mars.octa.edu,DNS,90,Standard query 0x3441 A self.events.data.microsoft.com,Other
91,6.992391,mars.octa.edu,FioImma.local,DNS,213,Standard query response 0x3441 A self.events.data.microsoft.com CNAME self-events-data.trafficmanager.net CNAME onedscolprdneu09.northeurope.cloudapp.azure.com A 13.69.239.77,Other
92,7.282719,FioImma.local,maa03s41-in-f14.1e100.net,TCP,1466,54642  >  443 [ACK] Seq=1 Ack=1 Win=512 Len=1412 [TCP PDU reassembled in 94],TCP Traffic
93,7.282719,FioImma.local,maa03s41-in-f14.1e100.net,TCP,1466,54642  >  443 [ACK] Seq=1413 Ack=1 Win=512 Len=1412 [TCP PDU reassembled in 94],TCP Traffic
94,7.282719,FioImma.local,maa03s41-in-f14.1e100.net,TLSv1.2,655,Application Data,Other
95,7.282871,FioImma.local,maa03s41-in-f14.1e100.net,TLSv1.2,93,Application Data,Other
96,7.29507,maa03s41-in-f14.1e100.net,FioImma.local,TCP,60,443  >  54642 [ACK] Seq=1 Ack=1413 Win=2048 Len=0,TCP Traffic
97,7.29507,maa03s41-in-f14.1e100.net,FioImma.local,TCP,60,443  >  54642 [ACK] Seq=1 Ack=2825 Win=2048 Len=0,TCP Traffic
98,7.29507,maa03s41-in-f14.1e100.net,FioImma.local,TCP,60,443  >  54642 [ACK] Seq=1 Ack=3426 Win=2048 Len=0,TCP Traffic
99,7.29507,maa03s41-in-f14.1e100.net,FioImma.local,TCP,60,443  >  54642 [ACK] Seq=1 Ack=3465 Win=2048 Len=0,TCP Traffic
100,7.29507,maa03s41-in-f14.1e100.net,FioImma.local,TLSv1.2,93,Application Data,Other
101,7.336551,FioImma.local,maa03s41-in-f14.1e100.net,TCP,54,54642  >  443 [ACK] Seq=3465 Ack=40 Win=512 Len=0,TCP Traffic
102,7.341228,maa03s41-in-f14.1e100.net,FioImma.local,TLSv1.2,131,Application Data,Other
103,7.341228,maa03s41-in-f14.1e100.net,FioImma.local,TLSv1.2,85,Application Data,Other
104,7.341228,maa03s41-in-f14.1e100.net,FioImma.local,TLSv1.2,93,Application Data,Other
105,7.341346,FioImma.local,maa03s41-in-f14.1e100.net,TCP,54,54642  >  443 [ACK] Seq=3465 Ack=187 Win=511 Len=0,TCP Traffic
106,7.342076,FioImma.local,maa03s41-in-f14.1e100.net,TLSv1.2,93,Application Data,Other
107,7.356135,maa03s41-in-f14.1e100.net,FioImma.local,TCP,60,443  >  54642 [ACK] Seq=187 Ack=3504 Win=2048 Len=0,TCP Traffic
108,7.403169,192.168.1.1,all-systems.mcast.net,IGMPv3,50,"Membership Query, general",Other
109,7.75177,FioImma.local,mars.octa.edu,DNS,99,Standard query 0x495a PTR 174.195.250.142.in-addr.arpa OPT,Other
110,7.752115,FioImma.local,mars.octa.edu,DNS,95,Standard query 0xcc20 PTR 1.1.168.192.in-addr.arpa OPT,Other
111,7.75248,FioImma.local,mars.octa.edu,DNS,93,Standard query 0xc241 PTR 1.0.0.224.in-addr.arpa OPT,Other
112,7.762509,mars.octa.edu,FioImma.local,DNS,128,Standard query response 0xc241 PTR 1.0.0.224.in-addr.arpa PTR all-systems.mcast.net OPT,Other
113,7.762509,mars.octa.edu,FioImma.local,DNS,138,Standard query response 0x495a PTR 174.195.250.142.in-addr.arpa PTR maa03s41-in-f14.1e100.net OPT,Other
114,7.772139,mars.octa.edu,FioImma.local,DNS,95,Standard query response 0xcc20 No such name PTR 1.1.168.192.in-addr.arpa OPT,Other
115,7.782178,FioImma.local,igmp.mcast.net,IGMPv3,54,Membership Report / Join group 224.0.0.251 for any sources,Other
116,7.988394,FioImma.local,20.212.88.117,TCP,55,54586  >  443 [ACK] Seq=1 Ack=1 Win=516 Len=1 [TCP PDU reassembled in 7456],TCP Traffic
117,8.080964,20.212.88.117,FioImma.local,TCP,66,443  >  54586 [ACK] Seq=1 Ack=2 Win=251 Len=0 SLE=1 SRE=2,TCP Traffic
118,8.749616,FioImma.local,mars.octa.edu,DNS,94,Standard query 0x8caf PTR 22.0.0.224.in-addr.arpa OPT,Other
119,8.750207,FioImma.local,mars.octa.edu,DNS,97,Standard query 0xed6b PTR 117.88.212.20.in-addr.arpa OPT,Other
120,8.768216,mars.octa.edu,FioImma.local,DNS,183,Standard query response 0xed6b No such name PTR 117.88.212.20.in-addr.arpa SOA ns1-01.azure-dns.com OPT,Other
121,8.768216,mars.octa.edu,FioImma.local,DNS,122,Standard query response 0x8caf PTR 22.0.0.224.in-addr.arpa PTR igmp.mcast.net OPT,Other
122,8.827836,FioImma.local,sa-in-f188.1e100.net,TCP,55,54584  >  5228 [ACK] Seq=1 Ack=1 Win=507 Len=1,TCP Traffic
123,8.827912,FioImma.local,sa-in-f188.1e100.net,TCP,55,54585  >  5228 [ACK] Seq=1 Ack=1 Win=510 Len=1,TCP Traffic
124,8.827932,FioImma.local,27.70.201.35.bc.googleusercontent.com,TCP,55,54747  >  443 [ACK] Seq=1 Ack=1 Win=512 Len=1,TCP Traffic
125,8.841251,27.70.201.35.bc.googleusercontent.com,FioImma.local,TCP,66,443  >  54747 [ACK] Seq=1 Ack=2 Win=301 Len=0 SLE=1 SRE=2,TCP Traffic
126,8.872348,sa-in-f188.1e100.net,FioImma.local,TCP,66,5228  >  54584 [ACK] Seq=1 Ack=2 Win=290 Len=0 SLE=1 SRE=2,TCP Traffic
127,8.872348,sa-in-f188.1e100.net,FioImma.local,TCP,66,5228  >  54585 [ACK] Seq=1 Ack=2 Win=290 Len=0 SLE=1 SRE=2,TCP Traffic
128,9.687895,FioImma.local,24.224.186.35.bc.googleusercontent.com,TCP,55,54610  >  443 [ACK] Seq=1 Ack=1 Win=510 Len=1 [TCP PDU reassembled in 7561],TCP Traffic
129,9.700724,24.224.186.35.bc.googleusercontent.com,FioImma.local,TCP,66,443  >  54610 [ACK] Seq=1 Ack=2 Win=489 Len=0 SLE=1 SRE=2,TCP Traffic
130,9.753113,FioImma.local,mars.octa.edu,DNS,98,Standard query 0x2414 PTR 188.200.125.74.in-addr.arpa OPT,Other
131,9.753695,FioImma.local,mars.octa.edu,DNS,96,Standard query 0xd706 PTR 27.70.201.35.in-addr.arpa OPT,Other
132,9.76093,mars.octa.edu,FioImma.local,DNS,132,Standard query response 0x2414 PTR 188.200.125.74.in-addr.arpa PTR sa-in-f188.1e100.net OPT,Other
133,9.790079,mars.octa.edu,FioImma.local,DNS,147,Standard query response 0xd706 PTR 27.70.201.35.in-addr.arpa PTR 27.70.201.35.bc.googleusercontent.com OPT,Other
134,10.285896,FioImma.local,maa03s41-in-f14.1e100.net,TCP,1466,54642  >  443 [ACK] Seq=3504 Ack=187 Win=511 Len=1412 [TCP PDU reassembled in 136],TCP Traffic
135,10.285896,FioImma.local,maa03s41-in-f14.1e100.net,TCP,1466,54642  >  443 [ACK] Seq=4916 Ack=187 Win=511 Len=1412 [TCP PDU reassembled in 136],TCP Traffic
136,10.285896,FioImma.local,maa03s41-in-f14.1e100.net,TLSv1.2,820,Application Data,Other
137,10.286103,FioImma.local,maa03s41-in-f14.1e100.net,TLSv1.2,311,Application Data,Other
138,10.298727,maa03s41-in-f14.1e100.net,FioImma.local,TCP,60,443  >  54642 [ACK] Seq=187 Ack=4916 Win=2048 Len=0,TCP Traffic
139,10.298727,maa03s41-in-f14.1e100.net,FioImma.local,TCP,60,443  >  54642 [ACK] Seq=187 Ack=6328 Win=2048 Len=0,TCP Traffic
140,10.298727,maa03s41-in-f14.1e100.net,FioImma.local,TCP,60,443  >  54642 [ACK] Seq=187 Ack=7094 Win=2048 Len=0,TCP Traffic
141,10.298727,maa03s41-in-f14.1e100.net,FioImma.local,TCP,60,443  >  54642 [ACK] Seq=187 Ack=7351 Win=2048 Len=0,TCP Traffic
142,10.343151,maa03s41-in-f14.1e100.net,FioImma.local,TLSv1.2,135,Application Data,Other
143,10.345408,maa03s41-in-f14.1e100.net,FioImma.local,TLSv1.2,85,Application Data,Other
144,10.345408,maa03s41-in-f14.1e100.net,FioImma.local,TLSv1.2,93,Application Data,Other
145,10.345486,FioImma.local,maa03s41-in-f14.1e100.net,TCP,54,54642  >  443 [ACK] Seq=7351 Ack=338 Win=510 Len=0,TCP Traffic
146,10.346309,FioImma.local,maa03s41-in-f14.1e100.net,TLSv1.2,93,Application Data,Other
147,10.356589,maa03s41-in-f14.1e100.net,FioImma.local,TCP,60,443  >  54642 [ACK] Seq=338 Ack=7390 Win=2048 Len=0,TCP Traffic
148,10.45092,FioImma.local,maa03s42-in-f22.1e100.net,TCP,55,54649  >  443 [ACK] Seq=1 Ack=1 Win=2047 Len=1 [TCP PDU reassembled in 282],TCP Traffic
149,10.462972,maa03s42-in-f22.1e100.net,FioImma.local,TCP,66,443  >  54649 [ACK] Seq=1 Ack=2 Win=489 Len=0 SLE=1 SRE=2,TCP Traffic
150,10.754135,FioImma.local,mars.octa.edu,DNS,97,Standard query 0xb0d1 PTR 24.224.186.35.in-addr.arpa OPT,Other
151,10.754567,FioImma.local,mars.octa.edu,DNS,99,Standard query 0x5dba PTR 214.195.250.142.in-addr.arpa OPT,Other
152,10.763903,mars.octa.edu,FioImma.local,DNS,138,Standard query response 0x5dba PTR 214.195.250.142.in-addr.arpa PTR maa03s42-in-f22.1e100.net OPT,Other
153,10.772928,mars.octa.edu,FioImma.local,DNS,149,Standard query response 0xb0d1 PTR 24.224.186.35.in-addr.arpa PTR 24.224.186.35.bc.googleusercontent.com OPT,Other
154,12.308428,FioImma.local,maa03s39-in-f10.1e100.net,TCP,55,54597  >  443 [ACK] Seq=1 Ack=1 Win=512 Len=1,TCP Traffic
155,12.322661,maa03s39-in-f10.1e100.net,FioImma.local,TCP,66,443  >  54597 [ACK] Seq=1 Ack=2 Win=400 Len=0 SLE=1 SRE=2,TCP Traffic
156,12.722203,FioImma.local,www.google.com,TCP,66,54799  >  443 [SYN] Seq=0 Win=64240 Len=0 MSS=1460 WS=256 SACK_PERM,TCP Traffic
157,12.734435,www.google.com,FioImma.local,TCP,66,"443  >  54799 [SYN, ACK] Seq=0 Ack=1 Win=65535 Len=0 MSS=1412 SACK_PERM WS=256",TCP Traffic
158,12.734578,FioImma.local,www.google.com,TCP,54,54799  >  443 [ACK] Seq=1 Ack=1 Win=131072 Len=0,TCP Traffic
159,12.73723,FioImma.local,www.google.com,TCP,1466,54799  >  443 [ACK] Seq=1 Ack=1 Win=131072 Len=1412 [TCP PDU reassembled in 160],TCP Traffic
160,12.73723,FioImma.local,www.google.com,TLSv1.3,884,Client Hello (SNI=www.google.com),Other
161,12.748692,www.google.com,FioImma.local,TCP,60,443  >  54799 [ACK] Seq=1 Ack=1413 Win=68608 Len=0,TCP Traffic
162,12.748692,www.google.com,FioImma.local,TCP,60,443  >  54799 [ACK] Seq=1 Ack=2243 Win=71424 Len=0,TCP Traffic
163,12.754726,FioImma.local,mars.octa.edu,DNS,99,Standard query 0xd6fe PTR 106.195.250.142.in-addr.arpa OPT,Other
164,12.759148,FioImma.local,mdns.mcast.net,MDNS,87,"Standard query 0x0000 PTR _spotify-connect._tcp.local, ""QM"" question",Other
165,12.759872,FioImma.local,ff02::fb,MDNS,107,"Standard query 0x0000 PTR _spotify-connect._tcp.local, ""QM"" question",Other
166,12.767626,FioImma.local,igmp.mcast.net,IGMPv3,54,Membership Report / Join group 239.255.255.250 for any sources,Other
167,12.782453,mars.octa.edu,FioImma.local,DNS,138,Standard query response 0xd6fe PTR 106.195.250.142.in-addr.arpa PTR maa03s39-in-f10.1e100.net OPT,Other
168,12.782453,www.google.com,FioImma.local,TLSv1.3,1466,"Server Hello, Change Cipher Spec",Other
169,12.784297,www.google.com,FioImma.local,TLSv1.3,105,Application Data,Other
170,12.784356,FioImma.local,www.google.com,TCP,54,54799  >  443 [ACK] Seq=2243 Ack=1464 Win=131072 Len=0,TCP Traffic
171,12.784966,FioImma.local,www.google.com,TLSv1.3,128,"Change Cipher Spec, Application Data",Other
172,12.801308,www.google.com,FioImma.local,TCP,60,443  >  54799 [ACK] Seq=1464 Ack=2317 Win=71424 Len=0,TCP Traffic
173,13.108065,FioImma.local,239.255.255.250,SSDP,167,M-SEARCH * HTTP/1.1 ,Other
174,13.338441,FioImma.local,45.224.186.35.bc.googleusercontent.com,TLSv1.2,82,Application Data,Other
175,13.350898,45.224.186.35.bc.googleusercontent.com,FioImma.local,TCP,60,443  >  54488 [ACK] Seq=1 Ack=29 Win=272 Len=0,TCP Traffic
176,13.423857,45.224.186.35.bc.googleusercontent.com,FioImma.local,TLSv1.2,78,Application Data,Other
177,13.46598,FioImma.local,45.224.186.35.bc.googleusercontent.com,TCP,54,54488  >  443 [ACK] Seq=29 Ack=25 Win=507 Len=0,TCP Traffic
178,13.762561,FioImma.local,mars.octa.edu,DNS,143,Standard query 0x319d PTR 6.e.3.2.8.4.d.1.3.c.4.9.5.1.4.c.0.0.0.0.0.0.0.0.0.0.0.0.0.8.e.f.ip6.arpa OPT,Other
179,13.762789,FioImma.local,mars.octa.edu,DNS,143,Standard query 0xe592 PTR b.f.0.0.0.0.0.0.0.0.0.0.0.0.0.0.0.0.0.0.0.0.0.0.0.0.0.0.2.0.f.f.ip6.arpa OPT,Other
180,13.762993,FioImma.local,mars.octa.edu,DNS,95,Standard query 0x5819 PTR 251.0.0.224.in-addr.arpa OPT,Other
181,13.763206,FioImma.local,mars.octa.edu,DNS,99,Standard query 0x33ee PTR 250.255.255.239.in-addr.arpa OPT,Other
182,13.763448,FioImma.local,mars.octa.edu,DNS,97,Standard query 0x234e PTR 45.224.186.35.in-addr.arpa OPT,Other
183,13.783732,mars.octa.edu,FioImma.local,DNS,123,Standard query response 0x5819 PTR 251.0.0.224.in-addr.arpa PTR mdns.mcast.net OPT,Other
184,13.783732,mars.octa.edu,FioImma.local,DNS,99,Standard query response 0x33ee No such name PTR 250.255.255.239.in-addr.arpa OPT,Other
185,13.79905,mars.octa.edu,FioImma.local,DNS,149,Standard query response 0x234e PTR 45.224.186.35.in-addr.arpa PTR 45.224.186.35.bc.googleusercontent.com OPT,Other
186,13.79905,mars.octa.edu,FioImma.local,DNS,207,Standard query response 0x319d No such name PTR 6.e.3.2.8.4.d.1.3.c.4.9.5.1.4.c.0.0.0.0.0.0.0.0.0.0.0.0.0.8.e.f.ip6.arpa SOA b.ip6-servers.arpa OPT,Other
187,13.801216,mars.octa.edu,FioImma.local,DNS,207,Standard query response 0xe592 No such name PTR b.f.0.0.0.0.0.0.0.0.0.0.0.0.0.0.0.0.0.0.0.0.0.0.0.0.0.0.2.0.f.f.ip6.arpa SOA b.ip6-servers.arpa OPT,Other
188,14.61397,FioImma.local,fonts.gstatic.com,TCP,55,54768  >  443 [ACK] Seq=1 Ack=1 Win=510 Len=1,TCP Traffic
189,14.625679,fonts.gstatic.com,FioImma.local,TCP,66,443  >  54768 [ACK] Seq=1 Ack=2 Win=290 Len=0 SLE=1 SRE=2,TCP Traffic
190,14.791834,FioImma.local,mars.octa.edu,DNS,97,Standard query 0xe564 PTR 35.67.250.142.in-addr.arpa OPT,Other
191,14.806361,mars.octa.edu,FioImma.local,DNS,135,Standard query response 0xe564 PTR 35.67.250.142.in-addr.arpa PTR maa05s12-in-f3.1e100.net OPT,Other
192,15.264566,FioImma.local,202.241.199.104.bc.googleusercontent.com,TCP,65,"54472  >  4070 [PSH, ACK] Seq=1 Ack=1 Win=512 Len=11",TCP Traffic
193,15.351637,202.241.199.104.bc.googleusercontent.com,FioImma.local,TCP,65,"4070  >  54472 [PSH, ACK] Seq=1 Ack=12 Win=6 Len=11",TCP Traffic
194,15.406777,FioImma.local,202.241.199.104.bc.googleusercontent.com,TCP,54,54472  >  4070 [ACK] Seq=12 Ack=12 Win=512 Len=0,TCP Traffic
195,15.424183,FioImma.local,20.198.119.143,TLSv1.2,155,Application Data,Other
196,15.468305,20.198.119.143,FioImma.local,TLSv1.2,225,Application Data,Other
197,15.516982,FioImma.local,20.198.119.143,TCP,54,49438  >  443 [ACK] Seq=102 Ack=172 Win=514 Len=0,TCP Traffic
198,15.69183,FioImma.local,maa05s24-in-f2.1e100.net,TCP,55,54764  >  443 [ACK] Seq=1 Ack=1 Win=512 Len=1 [TCP PDU reassembled in 7607],TCP Traffic
199,15.703206,maa05s24-in-f2.1e100.net,FioImma.local,TCP,66,443  >  54764 [ACK] Seq=1 Ack=2 Win=290 Len=0 SLE=1 SRE=2,TCP Traffic
200,15.771905,FioImma.local,igmp.mcast.net,IGMPv3,54,Membership Report / Join group 224.0.0.252 for any sources,Other
201,15.793606,FioImma.local,mars.octa.edu,DNS,99,Standard query 0xd222 PTR 202.241.199.104.in-addr.arpa OPT,Other
202,15.80398,FioImma.local,maa03s47-in-f14.1e100.net,TCP,55,54773  >  443 [ACK] Seq=1 Ack=1 Win=509 Len=1,TCP Traffic
203,15.812528,maa03s47-in-f14.1e100.net,FioImma.local,TCP,66,443  >  54773 [ACK] Seq=1 Ack=2 Win=301 Len=0 SLE=1 SRE=2,TCP Traffic
204,15.827924,mars.octa.edu,FioImma.local,DNS,153,Standard query response 0xd222 PTR 202.241.199.104.in-addr.arpa PTR 202.241.199.104.bc.googleusercontent.com OPT,Other
205,16.772766,FioImma.local,mars.octa.edu,DNS,98,Standard query 0x596c PTR 143.119.198.20.in-addr.arpa OPT,Other
206,16.773131,FioImma.local,mars.octa.edu,DNS,98,Standard query 0xb7eb PTR 98.193.250.142.in-addr.arpa OPT,Other
207,16.773406,FioImma.local,mars.octa.edu,DNS,99,Standard query 0x8e33 PTR 174.196.250.142.in-addr.arpa OPT,Other
208,16.780432,mars.octa.edu,FioImma.local,DNS,138,Standard query response 0x8e33 PTR 174.196.250.142.in-addr.arpa PTR maa03s47-in-f14.1e100.net OPT,Other
209,16.79001,mars.octa.edu,FioImma.local,DNS,184,Standard query response 0x596c No such name PTR 143.119.198.20.in-addr.arpa SOA ns1-06.azure-dns.com OPT,Other
210,16.79001,mars.octa.edu,FioImma.local,DNS,136,Standard query response 0xb7eb PTR 98.193.250.142.in-addr.arpa PTR maa05s24-in-f2.1e100.net OPT,Other
211,18.392312,FioImma.local,192.168.1.255,UDP,86,57621  >  57621 Len=44,UDP Traffic
212,18.773453,FioImma.local,mars.octa.edu,DNS,97,Standard query 0x6484 PTR 255.1.168.192.in-addr.arpa OPT,Other
213,18.78739,mars.octa.edu,FioImma.local,DNS,97,Standard query response 0x6484 No such name PTR 255.1.168.192.in-addr.arpa OPT,Other
214,19.254891,FioImma.local,browser-intake-datadoghq.com,TLSv1.3,339,Application Data,Other
215,19.255307,FioImma.local,browser-intake-datadoghq.com,TLSv1.3,93,Application Data,Other
216,19.255419,FioImma.local,browser-intake-datadoghq.com,TLSv1.3,984,Application Data,Other
217,19.480259,browser-intake-datadoghq.com,FioImma.local,TCP,60,443  >  54798 [ACK] Seq=1049 Ack=4124 Win=31744 Len=0,TCP Traffic
218,19.480259,browser-intake-datadoghq.com,FioImma.local,TCP,60,443  >  54798 [ACK] Seq=1049 Ack=4163 Win=31744 Len=0,TCP Traffic
219,19.480259,browser-intake-datadoghq.com,FioImma.local,TCP,60,443  >  54798 [ACK] Seq=1049 Ack=5093 Win=31744 Len=0,TCP Traffic
220,19.480259,browser-intake-datadoghq.com,FioImma.local,TLSv1.3,93,Application Data,Other
221,19.501287,browser-intake-datadoghq.com,FioImma.local,TLSv1.3,213,Application Data,Other
222,19.501404,FioImma.local,browser-intake-datadoghq.com,TCP,54,54798  >  443 [ACK] Seq=5093 Ack=1247 Win=129792 Len=0,TCP Traffic
223,19.503078,FioImma.local,browser-intake-datadoghq.com,TLSv1.3,89,Application Data,Other
224,19.600613,FioImma.local,onedscolprdneu09.northeurope.cloudapp.azure.com,TCP,66,54800  >  443 [SYN] Seq=0 Win=65535 Len=0 MSS=1460 WS=256 SACK_PERM,TCP Traffic
225,19.765442,browser-intake-datadoghq.com,FioImma.local,TCP,60,443  >  54798 [ACK] Seq=1247 Ack=5128 Win=31744 Len=0,TCP Traffic
226,19.775336,onedscolprdneu09.northeurope.cloudapp.azure.com,FioImma.local,TCP,66,"443  >  54800 [SYN, ACK] Seq=0 Ack=1 Win=65535 Len=0 MSS=1440 WS=256 SACK_PERM",TCP Traffic
227,19.775512,FioImma.local,onedscolprdneu09.northeurope.cloudapp.azure.com,TCP,54,54800  >  443 [ACK] Seq=1 Ack=1 Win=262144 Len=0,TCP Traffic
228,19.778866,FioImma.local,onedscolprdneu09.northeurope.cloudapp.azure.com,TLSv1.3,445,Client Hello (SNI=self.events.data.microsoft.com),Other
229,19.95155,onedscolprdneu09.northeurope.cloudapp.azure.com,FioImma.local,TLSv1.3,153,"Hello Retry Request, Change Cipher Spec",Other
230,19.951725,FioImma.local,onedscolprdneu09.northeurope.cloudapp.azure.com,TCP,54,54800  >  443 [ACK] Seq=392 Ack=100 Win=261888 Len=0,TCP Traffic
231,19.973729,FioImma.local,onedscolprdneu09.northeurope.cloudapp.azure.com,TLSv1.3,516,"Change Cipher Spec, Client Hello (SNI=self.events.data.microsoft.com)",Other
232,20.151598,onedscolprdneu09.northeurope.cloudapp.azure.com,FioImma.local,TLSv1.3,5894,Server Hello,Other
233,20.151598,onedscolprdneu09.northeurope.cloudapp.azure.com,FioImma.local,TLSv1.3,600,Application Data,Other
234,20.151708,FioImma.local,onedscolprdneu09.northeurope.cloudapp.azure.com,TCP,54,54800  >  443 [ACK] Seq=854 Ack=6486 Win=262144 Len=0,TCP Traffic
235,20.156509,FioImma.local,onedscolprdneu09.northeurope.cloudapp.azure.com,TLSv1.3,128,Application Data,Other
236,20.156928,FioImma.local,onedscolprdneu09.northeurope.cloudapp.azure.com,TLSv1.3,1083,Application Data,Other
237,20.328136,onedscolprdneu09.northeurope.cloudapp.azure.com,FioImma.local,TCP,60,443  >  54800 [ACK] Seq=6486 Ack=1957 Win=524288 Len=0,TCP Traffic
238,20.328136,onedscolprdneu09.northeurope.cloudapp.azure.com,FioImma.local,TLSv1.3,157,Application Data,Other
239,20.328136,onedscolprdneu09.northeurope.cloudapp.azure.com,FioImma.local,TLSv1.3,500,Application Data,Other
240,20.328334,FioImma.local,onedscolprdneu09.northeurope.cloudapp.azure.com,TCP,54,54800  >  443 [ACK] Seq=1957 Ack=7035 Win=261376 Len=0,TCP Traffic
241,21.512765,FioImma.local,20.44.10.123,TLSv1.2,307,Application Data,Other
242,21.513239,FioImma.local,20.44.10.123,TLSv1.2,771,Application Data,Other
243,21.513503,FioImma.local,20.44.10.123,TLSv1.2,92,Application Data,Other
244,21.768533,20.44.10.123,FioImma.local,TCP,60,443  >  54785 [ACK] Seq=1 Ack=971 Win=2048 Len=0,TCP Traffic
245,21.778053,FioImma.local,mars.octa.edu,DNS,96,Standard query 0x6aaa PTR 123.10.44.20.in-addr.arpa OPT,Other
246,21.814379,mars.octa.edu,FioImma.local,DNS,170,Standard query response 0x6aaa No such name PTR 123.10.44.20.in-addr.arpa SOA ns1-201.azure-dns.com OPT,Other
247,22.004436,20.44.10.123,FioImma.local,TCP,60,443  >  54785 [ACK] Seq=1 Ack=1009 Win=2048 Len=0,TCP Traffic
248,22.215821,20.44.10.123,FioImma.local,TLSv1.2,141,Application Data,Other
249,22.215931,FioImma.local,20.44.10.123,TCP,54,54785  >  443 [ACK] Seq=1009 Ack=88 Win=1021 Len=0,TCP Traffic
250,22.251906,FioImma.local,ec2-35-174-127-31.compute-1.amazonaws.com,TLSv1.2,297,Application Data,Other
251,22.44306,192.168.1.1,all-systems.mcast.net,IGMPv3,50,"Membership Query, general",Other
252,22.484294,ec2-35-174-127-31.compute-1.amazonaws.com,FioImma.local,TLSv1.2,320,Application Data,Other
253,22.532646,FioImma.local,ec2-35-174-127-31.compute-1.amazonaws.com,TCP,54,54503  >  443 [ACK] Seq=487 Ack=533 Win=512 Len=0,TCP Traffic
254,22.749082,www.google.com,FioImma.local,TCP,54,"443  >  54799 [FIN, ACK] Seq=1464 Ack=2317 Win=71424 Len=0",TCP Traffic
255,22.749199,FioImma.local,www.google.com,TCP,54,54799  >  443 [ACK] Seq=2317 Ack=1465 Win=131072 Len=0,TCP Traffic
256,22.777779,FioImma.local,igmp.mcast.net,IGMPv3,54,Membership Report / Join group 224.0.0.252 for any sources,Other
257,22.843395,FioImma.local,22.224.186.35.bc.googleusercontent.com,TCP,55,54599  >  443 [ACK] Seq=1 Ack=1 Win=509 Len=1 [TCP PDU reassembled in 2092],TCP Traffic
258,22.855864,22.224.186.35.bc.googleusercontent.com,FioImma.local,TCP,66,443  >  54599 [ACK] Seq=1 Ack=2 Win=489 Len=0 SLE=1 SRE=2,TCP Traffic
259,23.77471,FioImma.local,mars.octa.edu,DNS,97,Standard query 0x12bd PTR 22.224.186.35.in-addr.arpa OPT,Other
260,23.7897,mars.octa.edu,FioImma.local,DNS,149,Standard query response 0x12bd PTR 22.224.186.35.in-addr.arpa PTR 22.224.186.35.bc.googleusercontent.com OPT,Other
261,23.920677,FioImma.local,40.224.186.35.bc.googleusercontent.com,TLSv1.2,97,Application Data,Other
262,23.932166,40.224.186.35.bc.googleusercontent.com,FioImma.local,TCP,60,443  >  54517 [ACK] Seq=1 Ack=44 Win=290 Len=0,TCP Traffic
263,24.013995,40.224.186.35.bc.googleusercontent.com,FioImma.local,TLSv1.2,94,Application Data,Other
264,24.064,FioImma.local,40.224.186.35.bc.googleusercontent.com,TCP,54,54517  >  443 [ACK] Seq=44 Ack=41 Win=509 Len=0,TCP Traffic
265,24.372305,FioImma.local,20.42.72.131,TCP,55,54745  >  443 [ACK] Seq=1 Ack=1 Win=516 Len=1,TCP Traffic
266,24.589553,20.42.72.131,FioImma.local,TCP,66,443  >  54745 [ACK] Seq=1 Ack=2 Win=2048 Len=0 SLE=1 SRE=2,TCP Traffic
267,24.76981,FioImma.local,mars.octa.edu,DNS,97,Standard query 0xf8ce PTR 40.224.186.35.in-addr.arpa OPT,Other
268,24.770373,FioImma.local,mars.octa.edu,DNS,96,Standard query 0xfa5a PTR 131.72.42.20.in-addr.arpa OPT,Other
269,24.784107,mars.octa.edu,FioImma.local,DNS,182,Standard query response 0xfa5a No such name PTR 131.72.42.20.in-addr.arpa SOA ns1-08.azure-dns.com OPT,Other
270,24.807413,mars.octa.edu,FioImma.local,DNS,149,Standard query response 0xf8ce PTR 40.224.186.35.in-addr.arpa PTR 40.224.186.35.bc.googleusercontent.com OPT,Other
271,25.015967,browser-intake-datadoghq.com,FioImma.local,TLSv1.2,93,Application Data,Other
272,25.016323,FioImma.local,browser-intake-datadoghq.com,TCP,54,"54759  >  443 [FIN, ACK] Seq=2 Ack=40 Win=513 Len=0",TCP Traffic
273,25.181568,FioImma.local,52.123.173.4,TLSv1.2,104,Application Data,Other
274,25.24273,browser-intake-datadoghq.com,FioImma.local,TLSv1.2,78,Application Data,Other
275,25.24273,browser-intake-datadoghq.com,FioImma.local,TCP,54,"443  >  54759 [FIN, ACK] Seq=64 Ack=3 Win=62 Len=0",TCP Traffic
276,25.242798,FioImma.local,browser-intake-datadoghq.com,TCP,54,"54759  >  443 [RST, ACK] Seq=3 Ack=64 Win=0 Len=0",TCP Traffic
277,25.37254,52.123.173.4,FioImma.local,TLSv1.2,93,Application Data,Other
278,25.421004,FioImma.local,52.123.173.4,TCP,54,54673  >  443 [ACK] Seq=51 Ack=40 Win=512 Len=0,TCP Traffic
279,25.772714,FioImma.local,igmp.mcast.net,IGMPv3,54,Membership Report / Join group 224.0.0.251 for any sources,Other
280,25.78438,FioImma.local,mars.octa.edu,DNS,96,Standard query 0x979c PTR 4.173.123.52.in-addr.arpa OPT,Other
281,25.822217,mars.octa.edu,FioImma.local,DNS,182,Standard query response 0x979c No such name PTR 4.173.123.52.in-addr.arpa SOA ns1-06.azure-dns.com OPT,Other
282,28.420675,FioImma.local,maa03s42-in-f22.1e100.net,TLSv1.2,219,Ignored Unknown Record,Other
283,28.42076,FioImma.local,maa03s42-in-f22.1e100.net,TLSv1.2,93,Application Data,Other
284,28.433291,maa03s42-in-f22.1e100.net,FioImma.local,TCP,60,443  >  54649 [ACK] Seq=1 Ack=167 Win=489 Len=0,TCP Traffic
285,28.433291,maa03s42-in-f22.1e100.net,FioImma.local,TCP,60,443  >  54649 [ACK] Seq=1 Ack=206 Win=489 Len=0,TCP Traffic
286,28.433291,maa03s42-in-f22.1e100.net,FioImma.local,TLSv1.2,93,Application Data,Other
287,28.433291,maa03s42-in-f22.1e100.net,FioImma.local,TLSv1.2,171,Application Data,Other
288,28.433291,maa03s42-in-f22.1e100.net,FioImma.local,TLSv1.2,1466,Application Data,Other
289,28.433291,maa03s42-in-f22.1e100.net,FioImma.local,TLSv1.2,1466,Application Data,Other
290,28.433291,maa03s42-in-f22.1e100.net,FioImma.local,TLSv1.2,1466,Application Data,Other
291,28.433409,FioImma.local,maa03s42-in-f22.1e100.net,TCP,54,54649  >  443 [ACK] Seq=206 Ack=4393 Win=2051 Len=0,TCP Traffic
292,28.434247,maa03s42-in-f22.1e100.net,FioImma.local,TLSv1.2,4290,"Application Data, Application Data, Application Data",Other
293,28.434286,FioImma.local,maa03s42-in-f22.1e100.net,TCP,54,54649  >  443 [ACK] Seq=206 Ack=8629 Win=2051 Len=0,TCP Traffic
294,28.43454,FioImma.local,maa03s42-in-f22.1e100.net,TLSv1.2,89,Application Data,Other
295,28.434772,maa03s42-in-f22.1e100.net,FioImma.local,TLSv1.2,1466,Application Data,Other
296,28.434817,FioImma.local,maa03s42-in-f22.1e100.net,TCP,54,54649  >  443 [ACK] Seq=241 Ack=10041 Win=2051 Len=0,TCP Traffic
297,28.434867,maa03s42-in-f22.1e100.net,FioImma.local,TLSv1.2,1466,Application Data,Other
298,28.434889,FioImma.local,maa03s42-in-f22.1e100.net,TCP,54,54649  >  443 [ACK] Seq=241 Ack=11453 Win=2051 Len=0,TCP Traffic
299,28.434917,maa03s42-in-f22.1e100.net,FioImma.local,TLSv1.2,837,Application Data,Other
300,28.434966,maa03s42-in-f22.1e100.net,FioImma.local,TLSv1.2,93,Application Data,Other
301,28.434975,FioImma.local,maa03s42-in-f22.1e100.net,TCP,54,54649  >  443 [ACK] Seq=241 Ack=12275 Win=2048 Len=0,TCP Traffic
302,28.43507,FioImma.local,maa03s42-in-f22.1e100.net,TLSv1.2,93,Application Data,Other
303,28.445343,maa03s42-in-f22.1e100.net,FioImma.local,TCP,60,443  >  54649 [ACK] Seq=12275 Ack=280 Win=489 Len=0,TCP Traffic
304,30.383865,FioImma.local,clients.l.google.com,TCP,55,54628  >  443 [ACK] Seq=1 Ack=1 Win=510 Len=1 [TCP PDU reassembled in 7502],TCP Traffic
305,30.396551,clients.l.google.com,FioImma.local,TCP,66,443  >  54628 [ACK] Seq=1 Ack=2 Win=489 Len=0 SLE=1 SRE=2,TCP Traffic
306,30.559295,FioImma.local,www.google.com,TCP,54,"54799  >  443 [FIN, ACK] Seq=2317 Ack=1465 Win=131072 Len=0",TCP Traffic
307,30.559604,FioImma.local,www.google.com,TCP,66,54801  >  443 [SYN] Seq=0 Win=64240 Len=0 MSS=1460 WS=256 SACK_PERM,TCP Traffic
308,30.571208,www.google.com,FioImma.local,TCP,66,"443  >  54801 [SYN, ACK] Seq=0 Ack=1 Win=65535 Len=0 MSS=1412 SACK_PERM WS=256",TCP Traffic
309,30.571208,www.google.com,FioImma.local,TCP,54,443  >  54799 [ACK] Seq=1465 Ack=2318 Win=71424 Len=0,TCP Traffic
310,30.571355,FioImma.local,www.google.com,TCP,54,54801  >  443 [ACK] Seq=1 Ack=1 Win=131072 Len=0,TCP Traffic
311,30.572403,FioImma.local,www.google.com,TCP,1466,54801  >  443 [ACK] Seq=1 Ack=1 Win=131072 Len=1412 [TCP PDU reassembled in 312],TCP Traffic
312,30.572403,FioImma.local,www.google.com,TLSv1.3,430,Client Hello (SNI=www.google.com),Other
313,30.582847,www.google.com,FioImma.local,TCP,60,443  >  54801 [ACK] Seq=1 Ack=1413 Win=68608 Len=0,TCP Traffic
314,30.582847,www.google.com,FioImma.local,TCP,60,443  >  54801 [ACK] Seq=1 Ack=1789 Win=71424 Len=0,TCP Traffic
315,30.616326,www.google.com,FioImma.local,TLSv1.3,1466,"Server Hello, Change Cipher Spec",Other
316,30.618077,www.google.com,FioImma.local,TCP,2878,"443  >  54801 [PSH, ACK] Seq=1413 Ack=1789 Win=71424 Len=2824 [TCP PDU reassembled in 317]",TCP Traffic
317,30.618077,www.google.com,FioImma.local,TLSv1.3,1168,Application Data,Other
318,30.618148,FioImma.local,www.google.com,TCP,54,54801  >  443 [ACK] Seq=1789 Ack=5351 Win=131072 Len=0,TCP Traffic
319,30.619759,FioImma.local,www.google.com,TLSv1.3,128,"Change Cipher Spec, Application Data",Other
320,30.620067,FioImma.local,www.google.com,TLSv1.3,146,Application Data,Other
321,30.62036,FioImma.local,www.google.com,TCP,1466,54801  >  443 [ACK] Seq=1955 Ack=5351 Win=131072 Len=1412 [TCP PDU reassembled in 322],TCP Traffic
322,30.62036,FioImma.local,www.google.com,TLSv1.3,668,Application Data,Other
323,30.631206,www.google.com,FioImma.local,TCP,60,443  >  54801 [ACK] Seq=5351 Ack=3367 Win=74240 Len=0,TCP Traffic
324,30.631206,www.google.com,FioImma.local,TLSv1.3,1012,"Application Data, Application Data",Other
325,30.631206,www.google.com,FioImma.local,TLSv1.3,85,Application Data,Other
326,30.631271,FioImma.local,www.google.com,TCP,54,54801  >  443 [ACK] Seq=3981 Ack=6340 Win=130304 Len=0,TCP Traffic
327,30.631575,FioImma.local,www.google.com,TLSv1.3,85,Application Data,Other
328,30.643547,FioImma.local,www.google.com,TLSv1.3,127,Application Data,Other
329,30.647487,www.google.com,FioImma.local,TCP,60,443  >  54801 [ACK] Seq=6340 Ack=4012 Win=77056 Len=0,TCP Traffic
